{
  "id": "018f3c2a-8001-7000-a1b2-c3d4e5f60002",
  "revision": "018f3c2a-8001-7000-a1b2-c3d4e5f60002-r1",
  "session_id": "018f3c2a-8000-7000-a1b2-c3d4e5f60100",
  "student_id": "018f3c2a-7000-7000-a1b2-c3d4e5f60002",
  "scanned_at": "2026-06-16T08:32:00Z",
  "synced_time": null,
  "device_id": "tablet-bursar-01",
  "scanned_by": "018f3c2a-6000-7000-a1b2-c3d4e5f60001",
  "source": "manual_override",
  "status": "present",
  "void_reason": "Student present but forgot ID card — teacher confirmed identity"
}
